{
  "$schema": "http://json-schema.org/draft-07/schema#",
  "title": "장애인 지원 항목 표준 스키마",
  "description": "장애인등록혜택전단지(보건복지부)의 40여 개 지원 항목 각각에 대해, AI 비서가 실생활 질문에 답할 수 있도록 만든 구조화 스키마. 모든 항목 JSON 파일은 이 스키마를 따른다.",
  "version": "1.0.0",
  "last_updated": "2026-05-19",
  "type": "object",
  "required": [
    "id",
    "leaflet_section",
    "leaflet_number",
    "title",
    "short_summary",
    "category",
    "benefit_type",
    "supported_amount",
    "eligibility",
    "legal_basis",
    "how_to_use",
    "application",
    "sources",
    "last_verified",
    "version"
  ],
  "properties": {
    "id": {
      "type": "string",
      "pattern": "^B[0-9]{3,}$",
      "description": "항목 고유 ID. 형식: B + 숫자 3자리 이상 (예: B001, B051, B100)."
    },
    "leaflet_section": {
      "type": "string",
      "enum": [
        "심한장애(중증)/심하지 않은 장애(경증) 전국공통",
        "심한장애(중증) 전국공통",
        "저소득층(기초 및 차상위)",
        "기타"
      ],
      "description": "전단지에서의 구분 칸 값."
    },
    "leaflet_number": {
      "type": "integer",
      "description": "전단지 해당 구분 안에서의 원형 번호(①②③ …)."
    },
    "title": {
      "type": "string",
      "description": "항목 정식 이름. 예: '지하철, 전철 요금 100% 지원'.",
      "minLength": 1
    },
    "short_summary": {
      "type": "string",
      "description": "전단지 원문 그대로의 한 줄 요약.",
      "minLength": 1
    },
    "category": {
      "type": "string",
      "enum": [
        "교통",
        "통신",
        "공공시설",
        "주거",
        "의료",
        "보육·교육",
        "세제",
        "소득지원",
        "활동지원",
        "문화·체육",
        "기타"
      ],
      "description": "AI 비서 검색용 큰 분류."
    },
    "benefit_type": {
      "type": "string",
      "enum": [
        "면제",
        "감면",
        "할인",
        "현금지급",
        "현물지급",
        "서비스제공",
        "공제",
        "우선공급"
      ]
    },
    "supported_amount": {
      "type": "object",
      "properties": {
        "rate": {
          "type": [
            "string",
            "null"
          ],
          "description": "할인율 또는 지원율(예: '100%', '50%'). 비율 개념이 없는 항목(예: 자동차 표지 발급, 거주시설 입소)은 null 허용."
        },
        "amount": {
          "type": [
            "string",
            "null"
          ],
          "description": "정액 지원금이 있으면 표기."
        },
        "scope": {
          "type": "string",
          "description": "지원 적용 범위(어떤 비용/품목까지)."
        }
      }
    },
    "eligibility": {
      "type": "object",
      "properties": {
        "target": {
          "type": "string",
          "description": "대상자(예: '등록 장애인')."
        },
        "severity_levels": {
          "type": "array",
          "items": {
            "type": "string",
            "enum": [
              "심한 장애(중증)",
              "심하지 않은 장애(경증)"
            ]
          }
        },
        "companion_allowed": {
          "type": [
            "object",
            "null"
          ],
          "properties": {
            "applicable_to": {
              "type": "string"
            },
            "count": {
              "type": "integer"
            },
            "scope": {
              "type": "string"
            }
          }
        },
        "income_criteria": {
          "type": [
            "string",
            "null"
          ]
        },
        "age_criteria": {
          "type": [
            "string",
            "null"
          ]
        },
        "residency_criteria": {
          "type": [
            "string",
            "null"
          ]
        }
      }
    },
    "legal_basis": {
      "type": "array",
      "items": {
        "type": "object",
        "required": [
          "name"
        ],
        "properties": {
          "name": {
            "type": "string"
          },
          "article": {
            "type": [
              "string",
              "null"
            ],
            "description": "조문(예: '제30조')."
          },
          "url": {
            "type": [
              "string",
              "null"
            ],
            "format": "uri"
          },
          "law_ref_type": {
            "type": [
              "string",
              "null"
            ],
            "enum": [
              "law",
              "admrul",
              "ordin",
              "none",
              null
            ],
            "description": "근거 문서 유형 — law(법령: 법률·시행령·시행규칙) / admrul(행정규칙: 고시·훈령·예규) / ordin(자치법규: 조례) / none(비법령: 사업안내·약관·내규 등, 텍스트 유지)."
          },
          "law_id": {
            "type": [
              "string",
              "null"
            ],
            "description": "국가법령정보센터(law.go.kr) 법령ID(법령) / 행정규칙ID / 자치법규ID. 안정 식별자 — 개정돼도 불변."
          },
          "law_serial_no": {
            "type": [
              "string",
              "null"
            ],
            "description": "law.go.kr 일련번호(MST) — 특정 공포 버전을 가리키는 식별자."
          },
          "enforcement_date": {
            "type": [
              "string",
              "null"
            ],
            "pattern": "^[0-9]{8}$",
            "description": "매핑 시점 현행 버전의 시행일자(YYYYMMDD)."
          },
          "mapping_status": {
            "type": [
              "string",
              "null"
            ],
            "enum": [
              "matched",
              "fuzzy",
              "not_found",
              "not_applicable",
              "api_error",
              "pending_api",
              null
            ],
            "description": "matched=정확일치 / fuzzy=유사일치(검토 필요) / not_found=미발견 / not_applicable=비법령 / pending_api=미조회."
          },
          "mapping_confidence": {
            "type": [
              "string",
              "null"
            ],
            "description": "매핑 신뢰 표기 — exact(정확 일치) / fuzzy(유사 일치, 검토 권장) / manual(수기 확정) / 빈값(미매핑·해당 없음)."
          }
        }
      }
    },
    "operating_agencies": {
      "type": "array",
      "description": "운영기관별 차이(지역별 적용 노선·발급기관·예외).",
      "items": {
        "type": "object",
        "properties": {
          "region": {
            "type": "string"
          },
          "agency": {
            "type": "string"
          },
          "lines_or_routes": {
            "type": "array",
            "items": {
              "type": "string"
            }
          },
          "apply_channel": {
            "type": [
              "string",
              "null"
            ]
          },
          "card_or_proof_type": {
            "type": [
              "string",
              "null"
            ],
            "description": "필요한 카드·증명서. 신청·발급 채널이 아닌 정보 제공 포털 등에서는 null 허용."
          },
          "url": {
            "type": [
              "string",
              "null"
            ],
            "format": "uri"
          },
          "notes": {
            "type": [
              "string",
              "null"
            ]
          }
        }
      }
    },
    "how_to_use": {
      "type": "object",
      "properties": {
        "default": {
          "type": "string",
          "description": "일반적인 이용 방법(현장 무임/환급/카드 등)."
        },
        "with_card": {
          "type": [
            "string",
            "null"
          ]
        },
        "without_card": {
          "type": [
            "string",
            "null"
          ]
        },
        "exceptions": {
          "type": [
            "string",
            "null"
          ]
        }
      }
    },
    "application": {
      "type": "object",
      "properties": {
        "where": {
          "type": "array",
          "items": {
            "type": "object",
            "properties": {
              "channel": {
                "type": "string"
              },
              "method": {
                "type": "string",
                "enum": [
                  "방문",
                  "온라인",
                  "전화",
                  "우편",
                  "모바일 앱"
                ]
              },
              "url": {
                "type": [
                  "string",
                  "null"
                ],
                "format": "uri"
              }
            }
          }
        },
        "required_documents": {
          "type": "array",
          "items": {
            "type": "string"
          }
        },
        "processing_period": {
          "type": [
            "string",
            "null"
          ]
        },
        "fee": {
          "type": "object",
          "properties": {
            "default": {
              "type": "string"
            },
            "exceptions": {
              "type": [
                "string",
                "null"
              ]
            }
          }
        },
        "online_available": {
          "type": "boolean"
        },
        "proxy_allowed": {
          "type": "boolean"
        }
      }
    },
    "validity": {
      "type": "object",
      "properties": {
        "expiry": {
          "type": "string"
        },
        "renewal": {
          "type": "string"
        }
      }
    },
    "exceptions_and_caveats": {
      "type": "array",
      "items": {
        "type": "string"
      }
    },
    "penalties_for_misuse": {
      "type": [
        "string",
        "null"
      ]
    },
    "faq": {
      "type": "array",
      "items": {
        "type": "object",
        "required": [
          "q",
          "a"
        ],
        "properties": {
          "q": {
            "type": "string"
          },
          "a": {
            "type": "string"
          }
        }
      }
    },
    "contact": {
      "type": "array",
      "items": {
        "type": "object",
        "properties": {
          "name": {
            "type": "string"
          },
          "phone": {
            "type": [
              "string",
              "null"
            ]
          },
          "url": {
            "type": [
              "string",
              "null"
            ],
            "format": "uri"
          }
        }
      }
    },
    "sources": {
      "type": "array",
      "description": "근거·참고 자료 목록. 각 항목에 재크롤링용 메타데이터 포함.",
      "items": {
        "type": "object",
        "required": [
          "title",
          "publisher",
          "url"
        ],
        "properties": {
          "title": {
            "type": "string"
          },
          "publisher": {
            "type": "string"
          },
          "publisher_type": {
            "type": "string",
            "enum": [
              "중앙정부",
              "광역지자체",
              "기초지자체",
              "공기업",
              "법령DB",
              "공공데이터포털",
              "민간"
            ],
            "description": "기관 유형. 공식 출처 우선순위 판정에 사용."
          },
          "url": {
            "type": "string",
            "format": "uri"
          },
          "fallback_url": {
            "type": [
              "string",
              "null"
            ],
            "format": "uri"
          },
          "official_api": {
            "type": "object",
            "description": "공식 API 제공 여부. 공공데이터포털 등.",
            "properties": {
              "available": {
                "type": "boolean"
              },
              "endpoint": {
                "type": [
                  "string",
                  "null"
                ]
              },
              "auth_required": {
                "type": [
                  "boolean",
                  "null"
                ]
              },
              "docs_url": {
                "type": [
                  "string",
                  "null"
                ],
                "format": "uri"
              }
            }
          },
          "crawl": {
            "type": "object",
            "description": "재크롤링 설정. API가 없을 때 사용.",
            "properties": {
              "frequency": {
                "type": "string",
                "enum": [
                  "daily",
                  "weekly",
                  "monthly",
                  "quarterly",
                  "on_demand"
                ],
                "description": "권장 크롤 주기."
              },
              "change_detection_method": {
                "type": "string",
                "enum": [
                  "page_hash",
                  "last_modified_field",
                  "css_selector_text",
                  "pdf_hash",
                  "manual_review"
                ],
                "description": "변경 감지 방식."
              },
              "css_selector_hint": {
                "type": [
                  "string",
                  "null"
                ],
                "description": "변경 감지에 쓸 셀렉터 또는 텍스트 패턴."
              },
              "robots_txt_ok": {
                "type": [
                  "boolean",
                  "null"
                ]
              },
              "notes": {
                "type": [
                  "string",
                  "null"
                ]
              }
            }
          },
          "accessed": {
            "type": "string",
            "format": "date"
          },
          "priority": {
            "type": "string",
            "enum": [
              "primary",
              "secondary",
              "supplementary"
            ],
            "description": "primary는 법적/공식 1차 근거, secondary는 운영기관 공식 안내, supplementary는 보조 참고."
          }
        }
      },
      "minItems": 1
    },
    "related_items": {
      "type": "array",
      "description": "연관 항목 ID 리스트(예: ②번 철도요금 감면).",
      "items": {
        "type": "string"
      }
    },
    "last_verified": {
      "type": "string",
      "format": "date"
    },
    "version": {
      "type": "string",
      "minLength": 1
    },
    "active": {
      "type": "boolean",
      "description": "정책 활성 여부(soft delete). 미존재 시 활성으로 간주."
    },
    "deactivated_at": {
      "type": [
        "string",
        "null"
      ],
      "description": "비활성 적용 일시(ISO8601). 활성 시 null/미존재."
    }
  }
}