{
  "id": "B046",
  "leaflet_section": "심한장애(중증)/심하지 않은 장애(경증) 전국공통",
  "leaflet_number": 0,
  "title": "장애인 전용 금융권 상품 안내",
  "short_summary": "장애인의 자산 형성을 돕기 위해 시중은행 및 저축은행에서 예적금 가입 시 우대금리를 제공하며, 5천만 원 한도 내에서 비과세종합저축 혜택을 지원합니다.",
  "category": "소득지원",
  "benefit_type": "서비스제공",
  "supported_amount": {
    "rate": "은행 및 상품별 우대금리 상이 (예: 기본금리 + 0.5% ~ 2.5% 우대금리 적용)",
    "amount": "비과세종합저축 가입 시 1인당 저축원금 5천만 원 한도 내 이자·배당소득 비과세",
    "scope": "시중은행, 지방은행, 저축은행 등 취급 금융기관의 예적금 상품"
  },
  "eligibility": {
    "target": "「장애인복지법」에 따라 등록된 장애인 (단, 개별 예적금 상품에 따라 기초생활수급자, 차상위계층, 장애인연금 수급자 등 추가 요건이 있을 수 있음)"
  },
  "legal_basis": [
    {
      "name": "조세특례제한법",
      "article": "제88조의2(비과세종합저축에 대한 과세특례)",
      "url": "https://www.law.go.kr/법령/조세특례제한법"
    }
  ],
  "how_to_use": {
    "default": "취급 금융기관(은행, 저축은행 등) 영업점 방문 또는 비대면(스마트폰 앱, 인터넷뱅킹) 채널을 통해 장애인등록증, 장애인증명서 등 증빙서류를 제출하고 가입"
  },
  "application": {},
  "last_verified": "2026-06-26",
  "version": "1.0.0",
  "sources": [
    {
      "title": "조세특례제한법",
      "publisher": "국가법령정보센터",
      "url": "https://www.law.go.kr/법령/조세특례제한법",
      "priority": "primary"
    }
  ],
  "active": true
}