{
  "id": "B044",
  "leaflet_section": "기타",
  "leaflet_number": 0,
  "title": "경기도 장애인 기회소득",
  "short_summary": "스스로 건강을 챙기는 경기도 내 정도가 심한 장애인에게 가치활동(주 2회 이상 운동 등) 인증 시 월 10만 원을 지급하는 맞춤형 정책입니다.",
  "category": "소득지원",
  "benefit_type": "현금지급",
  "supported_amount": {
    "rate": "",
    "amount": "월 10만 원 (1인 최대 연 120만 원, 최대 30개월 지원)",
    "scope": "스마트워치를 활용한 건강상태 변화 등록, 건강 콘텐츠 수강, 주 2회 이상 가치활동 및 월 1회 사회참여 활동 인증 시 지급"
  },
  "eligibility": {
    "target": "경기도에 주민등록을 둔 13세 이상 64세 이하 '정도가 심한 장애인' 중 가구 기준 중위소득 120% 이하인 자"
  },
  "legal_basis": [
    {
      "name": "경기도 장애인 기회소득 지원 조례",
      "article": "",
      "url": "https://www.law.go.kr/자치법규/경기도장애인기회소득지원조례",
      "law_id": "2233612",
      "law_serial_no": "2007307",
      "law_ref_type": "ordin",
      "enforcement_date": "20250101",
      "mapping_status": "matched",
      "mapping_confidence": "exact"
    }
  ],
  "how_to_use": {
    "default": "경기민원24 누리집(gg24.gg.go.kr) 온라인 접수 또는 주민등록상 주소지 읍·면·동 행정복지센터 방문 신청"
  },
  "application": {},
  "last_verified": "2026-10-15",
  "version": "1.2.0",
  "sources": [
    {
      "title": "경기도 장애인 기회소득 사업 안내",
      "publisher": "경기도",
      "publisher_type": "광역지자체",
      "priority": "primary",
      "url": "https://job.gg.go.kr/jobSprt/detail.do?seq=1085",
      "crawl": {
        "frequency": "monthly",
        "change_detection_method": "page_hash",
        "css_selector_hint": null,
        "robots_txt_ok": true,
        "notes": "지원대상·지급액(월 10만원)·신청기간 변경 감시"
      }
    },
    {
      "title": "경기도 장애인 기회소득 지원 조례",
      "publisher": "국가법령정보센터",
      "publisher_type": "법령DB",
      "priority": "secondary",
      "url": "https://www.law.go.kr/자치법규/경기도장애인기회소득지원조례",
      "crawl": {
        "frequency": "monthly",
        "change_detection_method": "last_modified_field",
        "css_selector_hint": null,
        "robots_txt_ok": true,
        "notes": "연도와 무관한 근거 조례 — 지원 대상·금액 조항 개정 감시. 연도별 모집 공고는 매년 주소가 바뀌어 출처로 쓰지 않는다"
      }
    }
  ],
  "active": true
}