{
  "id": "B051",
  "leaflet_section": "기타",
  "leaflet_number": 0,
  "title": "긴급복지지원제도 (생계·의료·주거·교육 등 위기가구 긴급지원)",
  "short_summary": "갑작스러운 위기사유로 생계유지가 곤란해진 가구에 생계비·의료비·주거비 등을 신속하게 지원하여 위기상황에서 벗어나도록 돕는 제도입니다.",
  "category": "소득지원",
  "benefit_type": "현금지급",
  "supported_amount": {
    "rate": null,
    "amount": "2026년 기준 — 생계지원 월 783,000원(1인)·1,286,600원(2인)·1,644,000원(3인)·1,994,600원(4인)·2,324,400원(5인)·2,636,700원(6인), 7인 이상은 1인 증가마다 301,000원 추가 / 의료지원 회당 300만원 이내 / 주거지원 월 상한 대도시 398,900원(1~2인)·662,500원(3~4인)·874,100원(5~6인), 중소도시 299,100원·435,600원·574,200원, 농어촌 189,000원·250,500원·330,000원 / 사회복지시설 이용지원 월 상한 552,000원(1인)~2,047,400원(6인) / 교육지원 분기당 초등 127,900원·중학 180,000원·고등 214,000원과 수업료·입학금(학교장 고지액) / 연료비 월 150,000원 / 해산비 700,000원 / 장제비 800,000원 / 전기요금 500,000원 이내",
    "scope": "주지원(생계·의료·주거·사회복지시설 이용)과 부가지원(교육, 연료비, 해산비, 장제비, 전기요금), 그리고 사회복지공동모금회·대한적십자사 등 민간기관 긴급지원 프로그램 연계까지 포함한다. 생계지원 금액에는 2021년부터 냉방비가 포함되어 있다."
  },
  "eligibility": {
    "target": "위기사유가 발생하여 생계유지 등이 곤란해진 저소득 위기가구. 전 국민을 대상으로 하는 제도이며 장애인 전용 제도가 아니다. 위기사유는 주소득자의 사망·가출·행방불명·구금 등에 따른 소득상실, 중한 질병 또는 부상, 방임·유기·학대, 가정폭력·성폭력, 화재·자연재해, 휴업·폐업, 실직, 지방자치단체 조례로 정한 사유, 그 밖에 보건복지부장관이 고시하는 사유(이혼으로 인한 소득 감소, 단전, 교정시설 출소, 노숙, 복지사각지대 발굴대상자 추천, 자살고위험군, 범죄피해로 인한 거주지 이전 등)이다.",
    "severity_levels": [],
    "companion_allowed": null,
    "income_criteria": "2026년 기준 중위소득 75% 이하 — 1인 1,923,179원/월, 2인 3,149,469원, 3인 4,019,277원, 4인 4,871,054원, 5인 5,667,539원, 6인 6,416,964원(7인 이상은 1인 증가마다 719,399원 증가)",
    "age_criteria": null,
    "residency_criteria": "재산 기준은 대도시 2억 4,100만원·중소도시 1억 5,200만원·농어촌 1억 3,000만원 이하(주거용 재산 공제한도 대도시 6,900만원·중소도시 4,200만원·농어촌 3,500만원 적용 후 잔액 기준). 금융재산은 2026년 기준 1인 8,564,000원, 2인 10,199,000원, 3인 11,359,000원, 4인 12,494,000원, 5인 13,556,000원, 6인 14,555,000원 이하이며 주거지원은 가구원수별 금액에 200만원을 추가한다(7인 이상은 1인 증가마다 960,000원 추가)."
  },
  "legal_basis": [
    {
      "name": "긴급복지지원법",
      "article": "제2조, 제7조, 제9조",
      "law_ref_type": "law",
      "law_id": "010111",
      "law_serial_no": "270789",
      "enforcement_date": "20251023",
      "mapping_status": "matched",
      "mapping_confidence": "exact"
    },
    {
      "name": "긴급복지지원법 시행령",
      "article": "제2조~제6조",
      "law_ref_type": "law",
      "law_id": "010186",
      "law_serial_no": "242023",
      "enforcement_date": "20220503",
      "mapping_status": "matched",
      "mapping_confidence": "exact"
    },
    {
      "name": "긴급복지지원법 시행규칙",
      "article": null,
      "law_ref_type": "law",
      "law_id": "010183",
      "law_serial_no": "237465",
      "enforcement_date": "20220101",
      "mapping_status": "matched",
      "mapping_confidence": "exact"
    },
    {
      "name": "긴급지원 지원금액 및 재산의 합계액 기준",
      "article": null,
      "law_ref_type": "admrul",
      "law_id": "34024",
      "law_serial_no": "2100000269954",
      "enforcement_date": "20251217",
      "mapping_status": "matched",
      "mapping_confidence": "exact"
    }
  ],
  "how_to_use": {
    "default": "본인이나 가족, 이웃 등 관계인이 거주지 시·군·구청 또는 읍·면·동 행정복지센터에 지원을 요청하거나 보건복지상담센터(129)로 신고한다. 요청·신고를 받은 시·군·구는 1일 이내에 현장확인을 실시하고 요건이 인정되면 먼저 지원한 뒤 사후조사로 소득·재산을 확인하는 선지원 후조사 방식으로 운영된다.",
    "with_card": null,
    "without_card": null,
    "exceptions": "생계지원금은 3개월분을 한 번에 주지 않고 매월 지급하며, 1회차 지급 후 1개월 내 사후조사를 실시한다."
  },
  "application": {
    "where": [
      {
        "channel": "거주지 시·군·구청 또는 읍·면·동 행정복지센터",
        "method": "방문",
        "url": null
      },
      {
        "channel": "보건복지상담센터 129 (365일 24시간 상담·요청 접수 후 시·군·구 연계)",
        "method": "전화",
        "url": null
      }
    ],
    "required_documents": [
      "긴급지원 신청서(서식 1호) 또는 상담·신고 접수",
      "신분증",
      "위기사유를 확인할 수 있는 자료(사망진단서, 진단서·입원확인서, 화재발생확인원, 실직·폐업 증빙, 단전 확인자료, 가정폭력상담소·위기가정통합지원센터 추천서 등 사유별 상이)",
      "금융정보 등 제공 동의서",
      "가구원 보유계좌 잔액증명서 또는 거래내역(사후조사 시)"
    ],
    "processing_period": "지원요청·신고 후 1일 이내 현장확인, 요건 인정 시 즉시 선지원. 지원결정 후 1개월 내 사후조사, 3개월 내 적정성 심사",
    "fee": {
      "default": "없음",
      "exceptions": null
    },
    "online_available": false,
    "proxy_allowed": true
  },
  "validity": {
    "expiry": "생계지원 3개월(긴급지원심의위원회 심의로 3개월 범위 연장, 최대 6회) / 의료지원 1회(심의로 1회 추가연장, 최대 2회) / 주거지원 최대 12회 / 사회복지시설 이용지원 최대 6회 / 교육지원 최대 2회(주거지원 대상자는 분기별 최대 4회) / 연료비 최대 6회, 해산비·장제비·전기요금은 각 1회",
    "renewal": "지원이 종료되면 동일한 위기사유로는 다시 지원받을 수 없으나, 종료된 때부터 2년이 경과한 후에는 동일 위기사유가 다시 발생하면 지원받을 수 있다. 다른 위기사유일 경우 생계지원은 1년, 주거·시설이용지원은 3개월 경과 시 지원이 가능하다."
  },
  "exceptions_and_caveats": [
    "전 국민을 대상으로 하는 제도로, 장애인에 대한 금액 가산이나 기준 완화, 우선 지원 규정은 없다. 장애인과의 제도적 연결점은 「장애인활동 지원에 관한 법률」 제20조에 따른 활동지원기관의 장과 종사자 및 같은 법 제26조에 따른 활동지원인력이 긴급복지 신고의무자에 포함된다는 점, 그리고 장애인권익옹호기관이 응급상황 지원 관련 기관으로 발굴·연계에 참여한다는 점이다. 즉 수급 특례가 아니라 발굴 경로다.",
    "지원금액과 소득·재산 기준은 2026년 기준이며 매년 고시로 변경된다. 금액을 안내할 때는 반드시 기준 연도를 함께 밝혀야 한다.",
    "위기사유 중 지방자치단체 조례로 정한 사유(법 제2조 제8호)는 지역마다 다르므로, 거주지 시·군·구에서 인정하는 사유인지 확인이 필요하다. 서울형 긴급복지처럼 지자체가 자체 재원으로 운영하는 별도 사업도 있어 거주지에 따라 지원 범위가 달라진다.",
    "부가지원(교육, 연료비, 해산비, 장제비, 전기요금)은 해당 사항이 있을 때 주지원과 함께 지원할 수 있으나 반드시 지원해야 하는 것은 아니며, 예산 여건 등을 고려해 지방자치단체가 병행 여부를 결정한다.",
    "사후조사 결과 소득·재산이 기준을 초과하면 긴급지원심의위원회 심의를 거쳐 지원이 중단되거나 이미 지원한 비용을 환수할 수 있다.",
    "의료지원은 수술 또는 입원이 필요한 중한 질병·부상이 대상이며, 만성질환의 통상적인 요양·재활치료나 치과 진료 등은 원칙적으로 제외된다.",
    "장제비는 「산업재해보상보험법」 제71조 등 다른 법률에 따라 장제비를 이미 받은 경우 그 금액을 차감하여 지급한다."
  ],
  "penalties_for_misuse": "거짓이나 그 밖의 부정한 방법으로 지원받은 경우 긴급지원심의위원회 심의를 거쳐 지원을 중단하고 지원비용의 전부 또는 일부를 환수한다.",
  "faq": [
    {
      "q": "장애인인데 갑자기 생활이 어려워졌습니다. 긴급복지지원을 받을 수 있나요?",
      "a": "네, 신청할 수 있습니다. 다만 긴급복지지원은 장애인 전용 제도가 아니라 전 국민을 대상으로 하는 제도여서 장애가 있다는 이유만으로 지원되지는 않고, 주소득자의 사망·실직, 중한 질병이나 부상, 화재, 휴업·폐업 같은 위기사유가 발생해야 합니다. 소득이 2026년 기준 중위소득 75% 이하(1인 가구 월 1,923,179원)이고 재산·금융재산 기준을 충족하면 대상이 됩니다. 거주지 시·군·구청이나 읍·면·동 행정복지센터, 또는 보건복지상담센터 129로 요청하시면 됩니다."
    },
    {
      "q": "당장 먹을 것이 없는데 식비를 지원받을 수 있나요?",
      "a": "긴급복지지원의 생계지원이 식료품비와 의복비 등 생계유지비를 포함합니다. 2026년 기준으로 1인 가구는 월 783,000원, 4인 가구는 월 1,994,600원이 지급되며 원칙적으로 3개월간 매월 지급됩니다. 위기상황이 계속되면 심의를 거쳐 3개월 더 연장될 수 있습니다. 다만 식비만 따로 지원하는 제도는 아니고, 위기사유가 인정되어야 지원이 시작됩니다."
    },
    {
      "q": "지원을 신청하면 얼마나 기다려야 하나요?",
      "a": "요청이나 신고가 접수되면 담당 공무원이 1일 이내에 현장확인을 하고, 요건이 인정되면 소득·재산 조사를 마치기 전이라도 먼저 지원합니다. 소득·재산 조사는 지원이 시작된 뒤 1개월 안에 진행되며, 조사 결과 기준을 넘으면 지원이 중단되거나 이미 받은 금액을 돌려주어야 할 수 있습니다."
    },
    {
      "q": "전기가 끊겼거나 겨울 난방비가 없을 때도 도움을 받을 수 있나요?",
      "a": "소득 상실이나 현저한 감소로 전기가 끊긴 경우(전류제한기 부설 포함) 자체가 위기사유로 인정됩니다. 또한 생계지원이나 주거지원을 받는 가구에는 부가지원으로 10월부터 3월까지 월 15만원의 연료비와 50만원 이내의 전기요금을 지원할 수 있습니다. 다만 부가지원은 지방자치단체가 예산 여건을 고려해 병행 여부를 결정하므로 거주지 시·군·구에 확인이 필요합니다."
    },
    {
      "q": "한 번 지원받았는데 또 어려워지면 다시 받을 수 있나요?",
      "a": "같은 위기사유로는 지원이 종료된 뒤 2년이 지나야 다시 받을 수 있습니다. 다른 위기사유라면 생계지원은 1년, 주거지원과 사회복지시설 이용지원은 3개월이 지나면 지원이 가능합니다. 다만 가정폭력이나 가구구성원으로부터의 성폭력, 화재·자연재해로 주거생활이 곤란해진 경우에는 제한 없이 바로 지원될 수 있습니다."
    }
  ],
  "contact": [
    {
      "name": "보건복지상담센터",
      "phone": "129",
      "url": "https://www.129.go.kr"
    },
    {
      "name": "거주지 시·군·구청 및 읍·면·동 행정복지센터 긴급복지 담당",
      "phone": null,
      "url": null
    }
  ],
  "operating_agencies": [
    {
      "region": "전국",
      "agency": "시장·군수·구청장(긴급지원기관), 보건복지부(제도 총괄), 보건복지상담센터 129(담당기구)",
      "apply_channel": "시·군·구청 또는 읍·면·동 행정복지센터 방문, 보건복지상담센터 129 전화",
      "card_or_proof_type": null,
      "url": "https://www.mohw.go.kr",
      "notes": "지방자치단체 조례로 정한 위기사유와 자체 재원 긴급지원 사업(예: 서울형 긴급복지)은 지역별로 다르다."
    }
  ],
  "sources": [
    {
      "title": "2026년 긴급복지지원사업 안내",
      "publisher": "보건복지부",
      "publisher_type": "중앙정부",
      "url": "https://www.mohw.go.kr/board.es?act=view&bid=0009&list_no=1488509&mid=a10402000000",
      "fallback_url": "https://sasw.or.kr/data5/919368",
      "priority": "primary",
      "accessed": "2026-08-13",
      "crawl": {
        "frequency": "monthly",
        "change_detection_method": "page_hash",
        "css_selector_hint": null,
        "robots_txt_ok": true,
        "notes": "지원금액·소득재산 기준·위기사유 개정 감시. 연도별로 새 게시글이 등록되므로 차년도 사업안내 공개 시 list_no 교체 필요."
      }
    },
    {
      "title": "긴급지원 지원금액 및 재산의 합계액 기준(보건복지부 고시)",
      "publisher": "국가법령정보센터",
      "publisher_type": "법령DB",
      "url": "https://www.law.go.kr/행정규칙/긴급지원지원금액및재산의합계액기준",
      "fallback_url": null,
      "priority": "primary",
      "accessed": "2026-08-13",
      "crawl": {
        "frequency": "quarterly",
        "change_detection_method": "manual_review",
        "css_selector_hint": null,
        "robots_txt_ok": true,
        "notes": "급여별 지원금액의 법적 근거. 고시 개정 시 전 급여 금액이 함께 바뀌므로 개정 여부를 직접 확인한다."
      }
    },
    {
      "title": "긴급복지 생계지원 복지서비스 안내",
      "publisher": "복지로",
      "publisher_type": "중앙정부",
      "url": "https://www.bokjiro.go.kr/ssis-tbu/twataa/wlfareInfo/moveTWAT52011M.do?wlfareInfoId=WLF00003180",
      "fallback_url": "https://www.bokjiro.go.kr/ssis-tbu/twataa/wlfareInfo/moveTWAT52011M.do?wlfareInfoId=WLF00003179",
      "priority": "secondary",
      "accessed": "2026-08-13",
      "crawl": {
        "frequency": "monthly",
        "change_detection_method": "page_hash",
        "css_selector_hint": null,
        "robots_txt_ok": true,
        "notes": "생계지원 신청 안내·지원대상 변경 감시. fallback 은 의료지원 안내 페이지."
      }
    },
    {
      "title": "긴급복지지원법",
      "publisher": "국가법령정보센터",
      "publisher_type": "법령DB",
      "url": "https://www.law.go.kr/법령/긴급복지지원법",
      "fallback_url": null,
      "priority": "primary",
      "accessed": "2026-08-13",
      "crawl": {
        "frequency": "quarterly",
        "change_detection_method": "manual_review",
        "css_selector_hint": null,
        "robots_txt_ok": true,
        "notes": "위기사유(제2조)·신고의무자(제7조 제3항)·지원종류(제9조) 개정 감시."
      }
    }
  ],
  "related_items": [
    "B029",
    "B032",
    "B024"
  ],
  "last_verified": "2026-08-13",
  "version": "1.0.0",
  "active": true
}
