{
  "id": "B048",
  "leaflet_section": "심한장애(중증)/심하지 않은 장애(경증) 전국공통",
  "leaflet_number": 0,
  "title": "시각장애인 안내견 분양 및 훈련 지원",
  "short_summary": "시각장애인의 안전한 보행과 일상생활을 돕기 위해 보건복지부 지정 전문훈련기관을 통해 안내견을 분양하고 관련 교육을 지원합니다.",
  "category": "활동지원",
  "benefit_type": "서비스제공",
  "supported_amount": {
    "rate": "전액 무상 지원",
    "amount": "안내견 분양 및 교육 비용 전액",
    "scope": "안내견 매칭, 파트너 교육(약 4주), 사후관리 등"
  },
  "eligibility": {
    "target": "안내견을 통한 안전한 보행과 독립적인 일상생활을 희망하는 시각장애인"
  },
  "legal_basis": [
    {
      "name": "장애인복지법",
      "article": "제40조(장애인 보조견의 훈련ㆍ보급 지원 등)",
      "url": "https://www.law.go.kr/법령/장애인복지법/제40조"
    }
  ],
  "how_to_use": {
    "default": "보건복지부 지정 장애인 보조견 전문훈련기관(삼성화재안내견학교, 한국장애인도우미견협회 등)에 직접 분양 신청 후, 서류심사, 면접, 매칭 및 파트너 교육을 거쳐 분양받습니다."
  },
  "application": {
    "where": [
      {
        "channel": "삼성화재안내견학교",
        "method": "전화",
        "url": "https://guide.samsung.com"
      },
      {
        "channel": "한국장애인도우미견협회",
        "method": "전화",
        "url": "http://www.helpdog.org"
      }
    ],
    "required_documents": [
      "안내견 분양 신청서",
      "장애인 등록증(시각장애)"
    ],
    "processing_period": "신청 후 대기 기간 발생 (안내견 양성 및 매칭 상황에 따라 상이)",
    "fee": {
      "default": "무료"
    },
    "online_available": true,
    "proxy_allowed": false
  },
  "last_verified": "2026-07-03",
  "version": "1.0.0",
  "sources": [
    {
      "title": "장애인복지법",
      "publisher": "국가법령정보센터",
      "url": "https://www.law.go.kr/법령/장애인복지법",
      "priority": "primary"
    },
    {
      "title": "장애인 보조견 지원",
      "publisher": "찾기쉬운 생활법령정보",
      "url": "https://easylaw.go.kr/",
      "priority": "secondary"
    }
  ],
  "operating_agencies": [
    {
      "agency": "삼성화재안내견학교"
    },
    {
      "agency": "한국장애인도우미견협회"
    }
  ],
  "validity": {
    "expiry": "안내견 은퇴 시까지 (보통 분양 후 약 7~8년 활동)"
  },
  "exceptions_and_caveats": [
    "만 19세 이상(고등학교 졸업 기준)의 성인 시각장애인(전맹, 저시력 모두 가능)만 신청 가능합니다.",
    "주택(아파트/빌라), 기숙사, 직장 등 실내에서 지내야 하며, 활동 유지를 위해 매일 다니는 목적지(학교, 직장 등)가 있어야 합니다.",
    "입소교육(2주) 시 동반인 없이 안내견학교 숙소에서 24시간 생활하며 일상 관리와 보행교육을 받아야 합니다.",
    "개털 알레르기나 비염 등 건강상 이상이 없어야 하며, 중복장애(당뇨, 청각, 지체 등)가 있는 경우 심층 면담을 통해 분양을 결정합니다.",
    "장애인복지법 시행규칙 제30조의2에 따라 대중교통, 공공장소, 식당 등에서 안내견 동반 출입을 정당한 사유 없이 거부할 수 없으나, 의료기관의 무균실·수술실 등 감염관리가 필요한 곳이나 식품접객업 영업소의 조리장 등 위생관리가 필요한 곳은 출입이 제한될 수 있습니다."
  ],
  "contact": [
    {
      "name": "삼성화재안내견학교",
      "phone": "031-320-8922",
      "url": "https://guide.samsung.com"
    },
    {
      "name": "한국장애인도우미견협회",
      "phone": "031-691-7782",
      "url": "http://www.helpdog.org"
    }
  ],
  "faq": [
    {
      "q": "시각장애인 안내견은 어떻게 분양받나요",
      "a": "보건복지부 지정 전문훈련기관인 삼성화재안내견학교나 한국장애인도우미견협회에 전화로 상담한 후 신청서를 접수합니다. 이후 훈련기관 담당자가 가정을 방문하여 사육 환경과 보행 능력을 확인하는 1차 면담, 안내견과 함께 방문하여 매칭을 확인하는 2차 면담을 거칩니다. 매칭이 성사되면 안내견학교에 2주간 입소하여 교육을 받고, 이후 거주지와 직장 등 실제 생활 환경에서 2주간 현지 교육을 마친 뒤 최종적으로 분양받게 됩니다. 분양 및 교육 비용은 전액 무상입니다."
    },
    {
      "q": "안내견 분양 시 별도의 비용이 발생하나요?",
      "a": "아니요, 보건복지부 지정 전문훈련기관을 통해 분양받는 안내견의 경우 안내견 매칭, 파트너 교육, 사후관리 등에 드는 모든 비용은 전액 무상으로 지원됩니다."
    },
    {
      "q": "안내견과 함께 식당이나 카페에 들어갈 수 있나요?",
      "a": "네, 가능합니다. 장애인복지법에 따라 안내견을 동반한 시각장애인의 공공장소, 식당, 카페 등의 출입을 정당한 사유 없이 거부하는 것은 금지되어 있습니다. 다만, 위생 관리가 엄격히 필요한 조리장 등 특정 구역은 제한될 수 있습니다."
    },
    {
      "q": "안내견 분양 신청을 위해 반드시 전맹이어야 하나요?",
      "a": "아닙니다. 시각장애 정도와 관계없이 안내견을 통한 안전한 보행과 독립적인 일상생활이 필요한 저시력 장애인도 신청 가능합니다."
    },
    {
      "q": "안내견의 사후관리나 은퇴 후 지원은 어떻게 되나요",
      "a": "분양 후에도 전문훈련기관을 통해 정기적인 사후관리를 받을 수 있습니다. 안내견이 활동을 마친 후(약 7~8년)에는 은퇴견으로서의 삶을 지원하는 프로그램이나 관련 정책이 운영됩니다."
    },
    {
      "q": "안내견과 함께 대중교통 이용 시 주의사항이 있나요",
      "a": "장애인복지법에 따라 버스, 지하철 등 대중교통 이용 시 안내견 동반을 거부할 수 없습니다. 다만, 승객의 안전을 위해 운전기사나 승무원의 안내에 따라 질서 있게 탑승해야 하며, 다른 승객에게 피해를 주지 않도록 주의가 필요합니다."
    }
  ],
  "active": true
}