{
  "id": "B047",
  "leaflet_section": "기타",
  "leaflet_number": 0,
  "title": "장애인 주택 개조 비용 지원",
  "short_summary": "저소득 등록장애인의 주거 환경 개선을 위해 화장실 개조, 문턱 낮추기, 경사로 설치 등 주택 내 편의시설 및 안전장치 설치 비용을 지원하는 제도입니다.",
  "category": "주거",
  "benefit_type": "현금지급",
  "supported_amount": {
    "rate": "",
    "amount": "가구당 최대 380만원 (지자체별 상이)",
    "scope": "화장실 개조, 보조손잡이 설치, 문턱 낮추기, 싱크대 높이 조절, 주출입구 접근로(마당포장), 경사로 설치 등 주택 내 편의시설 및 안전장치 설치·개보수 비용"
  },
  "eligibility": {
    "target": "등록장애인 중 전년도 도시근로자 가구당 월평균 소득액 이하인 자가주택 소유자 및 임대주택 거주자 (국가나 지자체 등에서 동일·유사한 주택 개조 지원을 받고 3년이 경과하지 않은 경우 제외, 지자체별 세부 기준 상이)"
  },
  "legal_basis": [
    {
      "name": "장애인복지법",
      "article": "제2조",
      "law_ref_type": "law",
      "mapping_status": "matched",
      "mapping_confidence": "exact",
      "law_id": "000187",
      "law_serial_no": "281941",
      "enforcement_date": "20260701"
    },
    {
      "name": "장애인ㆍ고령자 등 주거약자 지원에 관한 법률 시행령",
      "article": "제7조",
      "law_ref_type": "law",
      "mapping_status": "fuzzy",
      "mapping_confidence": "fuzzy",
      "law_id": "011683",
      "law_serial_no": "277975",
      "enforcement_date": "20251001"
    }
  ],
  "how_to_use": {
    "default": "주소지 관할 읍·면·동 주민센터(행정복지센터) 방문 신청"
  },
  "application": {
    "where": [
      {
        "channel": "방문",
        "method": "방문",
        "url": ""
      }
    ],
    "required_documents": [
      "장애인주택 개조사업 지원 신청서",
      "개인정보 수집·이용·제공 동의서",
      "임대인 동의서 (임차 가구인 경우)",
      "장애인증명서",
      "소득증빙서류 (행복e음 확인 불가 시 건강보험료 납부확인서, 원천징수영수증 등)",
      "건축물대장 또는 건물 등기사항전부증명서",
      "대리인 신청 시 대리인 신분증 및 가족관계증명서"
    ],
    "processing_period": "신청 후 대상자 확정까지 약 1~2개월 소요 (지자체별 일정 상이)",
    "fee": {
      "default": "없음"
    },
    "online_available": false,
    "proxy_allowed": true
  },
  "last_verified": "2026-08-03",
  "version": "1.1.0",
  "sources": [
    {
      "title": "복지로 중증장애인 주택개조사업 (지자체)",
      "publisher": "복지로",
      "publisher_type": "공기업",
      "priority": "primary",
      "url": "https://www.bokjiro.go.kr/ssis-tbu/twataa/wlfareInfo/moveTWAT52011M.do?wlfareInfoId=WLF00003471",
      "crawl": {
        "frequency": "monthly",
        "change_detection_method": "page_hash",
        "css_selector_hint": null,
        "robots_txt_ok": true,
        "notes": "지원 대상·금액 변경 감시"
      }
    },
    {
      "title": "서울시 저소득 장애인 주거편의 지원사업",
      "publisher": "서울특별시",
      "publisher_type": "광역지자체",
      "priority": "secondary",
      "url": "https://housing.seoul.go.kr/site/main/content/sh01_070702",
      "crawl": {
        "frequency": "monthly",
        "change_detection_method": "page_hash",
        "css_selector_hint": null,
        "robots_txt_ok": true,
        "notes": "가구당 지원액(평균 340만원)·항목 변경 감시"
      }
    },
    {
      "title": "경기도 장애인 주택개조사업",
      "publisher": "경기도",
      "publisher_type": "광역지자체",
      "priority": "secondary",
      "url": "https://housing.gg.go.kr/html/24305.do",
      "crawl": {
        "frequency": "monthly",
        "change_detection_method": "page_hash",
        "css_selector_hint": null,
        "robots_txt_ok": true,
        "notes": "소득기준·지원항목 변경 감시"
      }
    }
  ],
  "operating_agencies": [
    {
      "agency": "지자체 (시·군·구청 및 읍·면·동 행정복지센터)"
    }
  ],
  "validity": {
    "expiry": "1회 지원 (동일·유사 사업 지원 후 3년 경과 시 재신청 가능)"
  },
  "exceptions_and_caveats": [
    "지원금액은 대상자에게 현금으로 직접 지급되지 않고, 지자체가 선정한 시공업체를 통해 집수리가 진행됩니다.",
    "국가·지자체·공공기관 등에서 동일 또는 유사한 주택개조 지원(수선유지급여 등)을 받고 3년이 경과하지 않은 경우 원칙적으로 지원이 제외됩니다 (단, 개조 항목이 중복되지 않는 경우 지자체 판단에 따라 예외적 지원 가능).",
    "임대주택 거주자의 경우 임대인의 동의서가 반드시 필요하며, 임대인에게 4년간 의무 임대 조건이 부여될 수 있습니다.",
    "비닐하우스, 컨테이너 등 불법건축물이나 비정상적인 거처는 지원 대상에서 제외됩니다.",
    "지자체별 예산 범위 내에서 우선순위(장애 정도, 고령, 시급성, 소득 등)에 따라 선정되므로 신청 인원이 많을 경우 탈락할 수 있습니다."
  ],
  "contact": [
    {
      "agency": "주소지 관할 읍·면·동 행정복지센터 또는 시·군·구청 담당 부서",
      "phone": "",
      "url": ""
    }
  ],
  "faq": [
    {
      "q": "장애인 주택 개조 비용을 지원받을 수 있나요?",
      "a": "네, 전년도 도시근로자 가구당 월평균 소득액 이하인 등록장애인 가구라면 신청할 수 있습니다. 가구당 최대 380만원 한도 내에서 화장실 개조, 문턱 낮추기, 안전손잡이 설치 등 주거용 편의시설 설치를 지원받을 수 있습니다. 단, 임차가구는 임대인의 동의가 필요하며, 최근 3년 이내 유사한 지원을 받은 경우 제외될 수 있습니다. 주소지 읍·면·동 행정복지센터에 방문하여 신청하시기 바랍니다."
    },
    {
      "q": "전세나 월세로 살고 있는 임차인도 신청 가능한가요?",
      "a": "네, 가능합니다. 다만, 집 구조를 변경하는 공사가 포함되므로 반드시 집주인(임대인)의 동의서가 필요합니다. 또한 지자체에 따라 지원 후 일정 기간 임대 조건을 유지해야 하는 의무 사항이 발생할 수 있으니 신청 전 확인이 필요합니다."
    },
    {
      "q": "지원금을 받아서 제가 직접 업체를 불러 공사해도 되나요?",
      "a": "아니요, 불가능합니다. 이 사업은 대상자에게 현금을 직접 지급하는 방식이 아니라, 지자체에서 선정하거나 지정한 시공업체를 통해 공사가 진행되는 방식으로 운영됩니다."
    },
    {
      "q": "소득 기준은 어떻게 확인하나요?",
      "a": "전년도 도시근로자 가구당 월평균 소득액 이하인지를 기준으로 합니다. 신청 시 건강보험료 납부확인서나 원천징수영수증 등 소득을 증빙할 수 있는 서류를 제출해야 하며, 행정정보 공동이용(행복e음)을 통해 확인 가능한 경우 별도 제출을 생략할 수도 있습니다."
    }
  ],
  "active": true
}