{
  "id": "B045",
  "leaflet_section": "심한장애(중증)/심하지 않은 장애(경증) 전국공통",
  "leaflet_number": 0,
  "title": "장애인 편의시설 안내 서비스(복지지도)",
  "short_summary": "복지로 웹사이트 및 모바일 앱의 '복지지도'를 통해 주민센터 등 전국 건축물의 휠체어 접근성 및 장애인 편의시설 설치 정보를 제공하는 서비스입니다.",
  "category": "공공시설",
  "benefit_type": "서비스제공",
  "supported_amount": {
    "rate": "",
    "amount": "",
    "scope": "전국 건축물의 8종 편의시설(출입구 경사로, 장애인전용주차구역, 장애인용 승강기, 장애인용 화장실, 주출입구 접근로, 출입구(문), 장애인객실, 시각장애인 안내표시) 설치 유무 및 BF(장애물 없는 생활환경) 인증 정보 제공"
  },
  "eligibility": {
    "target": "장애인, 노인, 임산부 등 편의시설 정보가 필요한 모든 국민"
  },
  "legal_basis": [
    {
      "name": "장애인ㆍ노인ㆍ임산부 등의 편의증진 보장에 관한 법률",
      "article": "제3조(편의시설 설치의 기본 원칙)",
      "url": "https://www.law.go.kr/법령/장애인ㆍ노인ㆍ임산부등의편의증진보장에관한법률",
      "law_id": "000186",
      "law_serial_no": "267429",
      "law_ref_type": "law",
      "enforcement_date": "20251221",
      "mapping_status": "fuzzy",
      "mapping_confidence": "fuzzy"
    }
  ],
  "how_to_use": {
    "default": "복지로 웹사이트(www.bokjiro.go.kr) 또는 복지로 모바일 앱 접속 후 '복지지도' 메뉴에서 방문하고자 하는 장소(예: 주민센터)를 검색하여 휠체어 접근성 및 편의시설 설치 현황 확인"
  },
  "application": {},
  "last_verified": "2026-08-03",
  "version": "1.1.0",
  "sources": [
    {
      "title": "복지로 복지지도 (전국 복지시설·편의시설 지도)",
      "publisher": "복지로",
      "publisher_type": "공기업",
      "priority": "primary",
      "url": "https://www.bokjiro.go.kr/ssis-tbu/twatca/wlfcl/wlfclPage.do",
      "crawl": {
        "frequency": "monthly",
        "change_detection_method": "page_hash",
        "css_selector_hint": null,
        "robots_txt_ok": true,
        "notes": "복지지도 서비스 페이지 — 서비스 개편·중단 감시"
      }
    },
    {
      "title": "장애인 편의시설 안내 서비스(복지지도) 시범 운영 보도자료",
      "publisher": "보건복지부",
      "publisher_type": "중앙정부",
      "priority": "secondary",
      "url": "https://www.mohw.go.kr/board.es?mid=a10503010100&bid=0027&act=view&list_no=374382",
      "crawl": {
        "frequency": "monthly",
        "change_detection_method": "page_hash",
        "css_selector_hint": null,
        "robots_txt_ok": true,
        "notes": "구 react URL 404 로 board.es 형식으로 교체(2026-08-03)"
      }
    },
    {
      "title": "복지로 위치정보 서비스 소개 (한국사회보장정보원)",
      "publisher": "한국사회보장정보원",
      "publisher_type": "공기업",
      "priority": "supplementary",
      "url": "http://www.ssis.or.kr/lay1/bbs/S1T67C101/B/101/view.do?article_seq=125995",
      "crawl": {
        "frequency": "monthly",
        "change_detection_method": "page_hash",
        "css_selector_hint": null,
        "robots_txt_ok": true,
        "notes": "운영기관 서비스 소개"
      }
    }
  ],
  "active": true
}