{
  "id": "B050",
  "leaflet_section": "심한장애(중증)/심하지 않은 장애(경증) 전국공통",
  "leaflet_number": 0,
  "title": "기존주택 전세임대주택 지원사업",
  "short_summary": "도심 내 저소득층(장애인 등)이 현 생활권에서 안정적으로 거주할 수 있도록 기존주택에 대해 전세계약을 체결한 후 저렴하게 재임대하여 주거안정을 지원합니다.",
  "category": "주거",
  "benefit_type": "현물지급",
  "supported_amount": {
    "rate": "전세보증금의 95% 지원 (입주자 부담 5%)",
    "amount": "수도권 1억 3,000만 원, 광역시 9,000만 원, 그 외 지역 7,000만 원 한도 내 지원",
    "scope": "전세보증금 지원 및 지원금액에 대한 저렴한 이자(연 1~2%) 부과"
  },
  "eligibility": {
    "target": "무주택세대구성원 중 전년도 도시근로자 가구당 월평균 소득 70% 이하인 장애인(1순위) 및 100% 이하인 장애인(2순위) 등"
  },
  "legal_basis": [
    {
      "name": "공공주택 특별법",
      "law_ref_type": "law",
      "mapping_status": "matched",
      "mapping_confidence": "exact",
      "law_id": "009595",
      "law_serial_no": "276937",
      "enforcement_date": "20260102"
    }
  ],
  "how_to_use": {
    "default": "관할 주민센터(행정복지센터) 방문 신청 후, 입주대상자로 선정되면 본인이 원하는 주택을 물색하여 LH 등 공공주택사업자와 전세계약 체결 후 입주"
  },
  "application": {
    "where": [
      {
        "channel": "관할 읍·면·동 주민센터(행정복지센터)",
        "method": "방문",
        "url": ""
      }
    ],
    "required_documents": [
      "신분증",
      "공급신청서 및 개인정보수집·이용동의서",
      "주민등록표등본 및 초본 (과거 주소 변동 이력 포함)",
      "가족관계증명서 (상세)",
      "금융정보 등 제공동의서, 자산보유사실확인서",
      "장애인등록증 또는 중증장애인 입증 서류 (해당자)",
      "대리 신청 시 위임장 및 대리인 신분증"
    ],
    "processing_period": "신청 마감일로부터 약 12주 후 개별 통보",
    "fee": {
      "default": "없음"
    },
    "online_available": false,
    "proxy_allowed": true
  },
  "last_verified": "2026-07-22",
  "version": "1.0.0",
  "sources": [
    {
      "title": "복지서비스 상세(중앙) - 기존주택 전세임대주택 지원사업",
      "publisher": "복지로",
      "url": "https://www.bokjiro.go.kr/ssis-tbu/twataa/wlfareInfo/moveTWAT52011M.do?wlfareInfoId=WLF00001138",
      "priority": "primary"
    }
  ],
  "faq": [
    {
      "q": "월세나 전세 보증금을 직접 현금으로 지원해주는 정책이 있나요?",
      "a": "본 사업은 월세를 직접 지급하는 것이 아니라, LH 등 공공주택사업자가 대상 주택과 전세계약을 체결한 뒤 입주자에게 저렴하게 재임대하는 방식입니다. 즉, 보증금의 대부분을 지원하여 입주자의 부담을 낮춰주는 형태입니다."
    },
    {
      "q": "전세보증금이 지원 한도액보다 비싼 집은 계약할 수 없나요?",
      "a": "지원 한도액을 초과하는 주택도 계약이 가능합니다. 다만, 초과하는 금액은 입주자가 전액 부담해야 하며, 총 전세금이 지원 한도액의 250% 이내여야 합니다."
    },
    {
      "q": "장애인이라면 누구나 신청할 수 있나요?",
      "a": "무주택세대구성원으로서 소득 기준(전년도 도시근로자 가구당 월평균 소득 70% 이하 또는 100% 이하)을 충족하는 장애인이 대상입니다. 1순위와 2순위에 따라 선정 우선순위가 달라질 수 있습니다."
    },
    {
      "q": "거주 기간은 최대 얼마나 되나요?",
      "a": "최초 임대기간은 2년이며, 자격 요건을 유지할 경우 2년 단위로 재계약을 통해 최장 20년까지 거주가 가능합니다."
    }
  ],
  "operating_agencies": [
    {
      "agency": "한국토지주택공사(LH) 및 각 지방도시공사(SH, GH, iH 등)",
      "region": "전국",
      "apply_channel": "관할 읍·면·동 주민센터(행정복지센터) 방문 신청",
      "url": "https://apply.lh.or.kr",
      "notes": "지역별로 관할 공사(LH, SH, GH 등)가 다르며, 지자체 모집 공고에 따라 신청"
    }
  ],
  "validity": {
    "expiry": "최초 임대기간 2년, 자격 유지 시 2년 단위로 최대 9회 재계약 가능 (최장 20년 거주)"
  },
  "exceptions_and_caveats": [
    "무주택세대구성원 전원이 주택을 소유하지 않아야 하며, 계약 체결 시까지 무주택 요건을 유지해야 합니다. 지원 한도액을 초과하는 전세주택은 초과분을 입주자가 전액 부담하는 조건으로 계약 가능하나, 총 전세금이 지원 한도액의 250% 이내여야 합니다. 부채비율 등 권리분석 기준을 충족하는 주택만 계약이 가능하므로 가계약 전 반드시 LH 등 사업자의 승인을 받아야 합니다. 매년 도시근로자 가구당 월평균 소득 기준이 변경되므로 모집 공고문을 확인해야 합니다."
  ],
  "contact": [
    {
      "name": "LH 콜센터 1600-1004 (https://apply.lh.or.kr), 보건복지상담센터 129"
    }
  ],
  "active": true
}